{"organizations": ["Fox News Latino FILE", "AP"], "uuid": "503db7d1105f5e5441eeef0b573607b9cb674850", "thread": {"site_full": "latino.foxnews.com", "main_image": "http://a57.foxnews.com/global.fncstatic.com/static/managed/img/fn-latino/politics/0/0/GOP%202016%20Bush%20Lobbyin_Vros.jpg", "site_section": "http://feeds.latino.foxnews.com/home/feed", "section_title": "FOX News", "url": "http://latino.foxnews.com/latino/politics/2015/08/03/jeb-bush-unveils-strategy-to-bolster-border-security-overhaul-immigration-laws/", "country": "IL", "title": "Jeb Bush unveils strategy to bolster border security, overhaul immigration laws", "performance_score": 0, "site": "foxnews.com", "participants_count": 0, "title_full": "Jeb Bush unveils strategy to bolster border security, overhaul immigration laws", "spam_score": 0.0, "site_type": "news", "published": "2015-08-03T17:23:00.000+03:00", "replies_count": 0, "uuid": "503db7d1105f5e5441eeef0b573607b9cb674850"}, "author": "", "url": "http://latino.foxnews.com/latino/politics/2015/08/03/jeb-bush-unveils-strategy-to-bolster-border-security-overhaul-immigration-laws/", "ord_in_thread": 0, "title": "Jeb Bush unveils strategy to bolster border security, overhaul immigration laws", "locations": ["Washington", "Miami-Dade County", "Florida", "D.C."], "entities": {"persons": [], "locations": [], "organizations": []}, "highlightText": "", "language": "english", "persons": ["Jeb Bush", "Bush", "Martinez Monsivais"], "text": "Jeb Bush unveils strategy to bolster border security, overhaul immigration laws   Fox News Latino FILE - In this June 19, 2015, file photo, Republican presidential candidate former Florida Gov. Jeb Bush speaks in Washington. Announcing his bid for the presidency, Bush said he would \"challenge the culture that has made lobbying the premier growth industry in our nationâs capital.\" Four days later, Bush was in Washington for a fundraising luncheon co-hosted by D.C. lobbyists. For Bush, the connection is not new. Before he was Florida governor, Bush was a registered lobbyist in Miami-Dade County, though a spokeswoman said he never actually lobbied. (AP Photo/Pablo Martinez Monsivais, File) \nMIAMI (AP) – Republican presidential candidate Jeb Bush is outlining a six-point strategy to bolster security at the nation's border and overhaul its immigration laws. \nThe former Florida governor said Monday that finding a solution to the status of people in the country illegally \"is a nonstarter if our borders are not secure against future illegal immigration.\" \nBush is proposing the estimated 11 million people living in the country illegally could earn legal status \"over time,\" after they pass a criminal background check, pay a fine and learn English, among other requirements. \nBush outlined his proposal Monday morning, before traveling to New Hampshire to speak at an evening forum. Bush posted details of his plan to medium.com, a social media website. \nLike us on Facebook", "external_links": [], "published": "2015-08-03T17:23:00.000+03:00", "crawled": "2015-08-03T19:02:58.811+03:00", "highlightTitle": "", "social": {"gplus": {"shares": 0}, "pinterest": {"shares": 0}, "vk": {"shares": 0}, "linkedin": {"shares": 0}, "facebook": {"likes": 0, "shares": 0, "comments": 0}, "stumbledupon": {"shares": 0}}}