{"organizations": ["European Union Commission"], "uuid": "c89c37e273314ff3909dafb58115efd2c18d8646", "thread": {"site_full": "edition.cnn.com", "main_image": "http://i2.cdn.turner.com/cnnnext/dam/assets/150608120430-obama-merkel-1-story-top.jpg", "site_section": "http://rss.cnn.com/rss/cnn_allpolitics.rss&author=CNN&title=Politics", "section_title": "CNN.com - Politics", "url": "http://edition.cnn.com/2015/06/08/politics/obama-abadi-iraq-germany-g7/index.html", "country": "US", "title": "Obama, Merkel: Best friends in Bavaria", "performance_score": 0, "site": "cnn.com", "participants_count": 0, "title_full": "Obama, Merkel: Best friends in Bavaria", "spam_score": 0.0, "site_type": "news", "published": "2015-06-08T20:32:00.000+03:00", "replies_count": 0, "uuid": "43ee4b12c59729547f4f6849ae43cbec1c152eb7"}, "author": "", "url": "http://edition.cnn.com/2015/06/08/politics/gallery/barack-obama-angela-merkel-germany-bffs/index.html", "ord_in_thread": 0, "title": "Obama, Merkel: Best friends in Bavaria", "locations": ["Garmisch-Partenkirchen", "Kruen", "U.S.", "Bavaria", "Elmau Castle", "Germany", "Bavaria Obama"], "entities": {"persons": [], "locations": [], "organizations": []}, "highlightText": "", "language": "english", "persons": ["David Cameron", "Matteo Renzi", "Shinzo Abe", "Barack Obama", "Renzi", "Francois Hollande", "Jean-Claude Juncker", "Donald Tusk", "Merkel", "Stephen Harper", "Angela Merkel", "Ellen Johnson Sirleaf", "Obama"], "text": "Obama, Merkel: Best friends in Bavaria Updated 1850 GMT (0150 HKT) June 8, 2015 Obama, Merkel: Best friends in Bavaria 8 photos U.S. President Barack Obama and German Chancellor Angela Merkel stroll outside at the summit of the Group of Seven nations at the Schloss Elmau resort on Sunday, June 7, near Garmisch-Partenkirchen, Germany. Hide Caption Obama, Merkel: Best friends in Bavaria 8 photos Obama and Merkel attend a concert on June 7. Hide Caption 2 of 8 Obama, Merkel: Best friends in Bavaria 8 photos Obama enjoys a beer with Merkel, right, at the summit of G7 nations on June 7 in Kruen, Germany. Hide Caption Obama, Merkel: Best friends in Bavaria 8 photos Obama and Merkel greet each other at a bilateral meeting on June 7. Hide Caption 4 of 8 Obama, Merkel: Best friends in Bavaria 8 photos Merkel and Obama chat while posing for a group photo on Monday, June 8, the second day of the summit of G7 nations. Hide Caption 5 of 8 Obama, Merkel: Best friends in Bavaria 8 photos From left: European Council President Donald Tusk, Japanese Prime Minister Shinzo Abe, Canadian Prime Minister Stephen Harper, Obama, Merkel, French President Francois Hollande, British Prime Minister David Cameron, Italian Prime Minister Matteo Renzi and European Union Commission President Jean-Claude Juncker pose for a photo at Elmau Castle near Garmisch-Partenkirchen, southern Germany, on June 7. Hide Caption 6 of 8 Obama, Merkel: Best friends in Bavaria 8 photos Obama and Merkel walk on their way to their first working session at Elmau Castle on June 7. Hide Caption 7 of 8 Obama, Merkel: Best friends in Bavaria 8 photos On the bench, from left: Liberian President Ellen Johnson Sirleaf, Merkel, Obama and Renzi sit on a bench outside Elmau Castle on June 8. Hide Caption 8 of 8 U.S. President Barack Obama and German Chancellor Angela Merkel spent some quality time together drinking German beer and wandering the fields of Bavaria at the G7 Summit in southern Germany. More from Politics", "external_links": [], "published": "2015-06-08T20:32:00.000+03:00", "crawled": "2015-06-08T22:45:27.000+03:00", "highlightTitle": "", "social": {"gplus": {"shares": 0}, "pinterest": {"shares": 0}, "vk": {"shares": 0}, "linkedin": {"shares": 0}, "facebook": {"likes": 0, "shares": 0, "comments": 0}, "stumbledupon": {"shares": 0}}}