{"organizations": ["USAID", "University of Cape Town", "Obamas", "House of Slaves", "Symbion Power Plant", "CNN", "University of Johannesburg Soweto", "Farmers Federation", "State House"], "uuid": "d5cbe62e2442bb2b403aa118962129c17ceb98a4", "thread": {"site_full": "edition.cnn.com", "main_image": "http://i2.cdn.turner.com/cnnnext/dam/assets/130701124046-01-obama-africa-0630-t3-entertainment.jpg", "site_section": "http://rss.cnn.com/rss/cnn_latest.rss", "section_title": "CNN.com Recently Published/Updated", "url": "http://edition.cnn.com/2015/06/19/politics/faith-and-freedom-threat-washington/index.html", "country": "US", "title": "Obama to be first sitting U.S. president to visit Ethiopia", "performance_score": 0, "site": "cnn.com", "participants_count": 0, "title_full": "Obama to be first sitting U.S. president to visit Ethiopia", "spam_score": 0.0, "site_type": "news", "published": "2015-06-19T21:01:00.000+03:00", "replies_count": 0, "uuid": "d541712215c3263c046d00c2af88e52687612a54"}, "author": "", "url": "http://edition.cnn.com/2015/06/19/politics/obama-visit-ethiopia/index.html", "ord_in_thread": 0, "title": "Obama to be first sitting U.S. president to visit Ethiopia", "locations": ["Dakar", "Washington", "Tanzania", "Dar Es Salaam", "Cape Town", "Johannesburg", "West Africa", "America", "Kenya", "U.S.", "Ethiopia", "Ubungo", "Senegal", "Robben Island", "Africa", "Goree Island", "South Africa", "Pretoria", "Dar es Salaam"], "entities": {"persons": [], "locations": [], "organizations": []}, "highlightText": "", "language": "english", "persons": ["Ahmed Kathrada", "Kikwete", "Jacob Zuma", "Barack Obama", "George W. Bush", "Barack", "Kristen Holmes", "Salma Kikwete", "Josh Earnest", "Nimna Diayte", "Macky Sall", "Obama", "Michelle Obama", "Marieme Faye Sall", "Sall", "Rajiv Shah", "Desmond Tutu", "Zuma", "Tobeka Madiba Zuma", "Nelson Mandela", "Jakaya Kikwete"], "text": "CNN.com <div class=\"banner\" id=\"cnn_300x250_sync_freewheel-rail_0_banner\"><span id=\"cnn_300x250_sync_freewheel-rail_0\" class=\"_fwph\"><form id=\"_fw_form_cnn_300x250_sync_freewheel-rail_0\" style=\"display:none\"><input type=\"hidden\" name=\"_fw_input_cnn_300x250_sync_freewheel-rail_0\" id=\"_fw_input_cnn_300x250_sync_freewheel-rail_0\" value=\"ptgt=s&envp=g_js&w=300&h=250&slau=300x250_sync&adUnit=300x250_sync\"></form><span id=\"_fw_container_cnn_300x250_sync_freewheel-rail_0\" class=\"cn-shingle__ad\"></span></span></div> Obama to be first sitting U.S. President to visit Ethiopia By Kristen Holmes , CNN White House Producer Updated 1901 GMT (0201 HKT) June 19, 2015 Photos: Obama's tour of Africa 26 photos Obama's tour of Africa – President Barack Obama kicks around an energy-generating soccer ball at a power plant in Dar es Salaam, Tanzania, on Tuesday, July 2. Obama was pushing for partnerships in energy as he concluded a three-nation trip to Africa. Tanzanian President Jakaya Kikwete, third from right, joined Obama at the Symbion Power Plant at Ubungo. Hide Caption 1 of 26 Photos: Obama's tour of Africa 26 photos Obama's tour of Africa – Tanzania's president, left, watches as Obama plays with the energy-generating soccer ball at the Symbion Power Plant on July 2. \"I don't want to get too technical, but I thought it was pretty cool,\" Obama said of the ball that harnesses kinetic energy to provide power. Hide Caption 2 of 26 Photos: Obama's tour of Africa 26 photos Obama's tour of Africa – Former President George W. Bush joins Obama during a July 2 wreath-laying ceremony in Dar es Salaam to honor the victims of the 1998 terror attack at the U.S. Embassy in Tanzania. Hide Caption 3 of 26 Photos: Obama's tour of Africa 26 photos Obama's tour of Africa – A Tanzanian band plays as the U.S. president and first lady Michelle Obama arrive in Dar es Salaam on Monday, July 1. Hide Caption 4 of 26 Photos: Obama's tour of Africa 26 photos Obama's tour of Africa – Traditional dancers perform as Tanzanian first lady Mama Salma Kikwete greets Michelle Obama in Dar es Salaam on July 1. Hide Caption 5 of 26 Photos: Obama's tour of Africa 26 photos Obama's tour of Africa – Tanzanian President Jakaya Kikwete toasts Obama during an official dinner at the State House in Dar Es Salaam on July 1. Hide Caption 6 of 26 Photos: Obama's tour of Africa 26 photos Obama's tour of Africa – Obama and Kikwete, right, are greeted by a cheering crowd as they arrive at the State House in Dar es Salaam, Tanzania, on Monday, July 1. Hide Caption 7 of 26 Photos: Obama's tour of Africa 26 photos Obama's tour of Africa – Ahmed Kathrada, a former fellow prisoner with Nelson Mandela, shows the Obama family around Robben Island in Cape Town, South Africa, on Sunday, June 30. The island, where prisoners were banished and isolated during the apartheid era, is now a museum. Hide Caption 8 of 26 Photos: Obama's tour of Africa 26 photos Obama's tour of Africa – Obama looks out the window of the cell on Robben Island where Nelson Mandela was imprisoned. Hide Caption 9 of 26 Photos: Obama's tour of Africa 26 photos Obama's tour of Africa – Obama delivers a speech at the University of Cape Town in Cape Town, South Africa, on June 30. Hide Caption 10 of 26 Photos: Obama's tour of Africa 26 photos Obama's tour of Africa – Obama visits the Desmond Tutu HIV Foundation Youth Centre with Nobel peace laureate Archbishop Desmond Tutu and 15-year-old Aviwe Mtongana in Cape Town on June 30. Hide Caption 11 of 26 Photos: Obama's tour of Africa 26 photos Obama's tour of Africa – Obama, foreground left, and first lady Michelle Obama, beside him, are greeted by South African President Jacob Zuma and his wife, Tobeka Madiba Zuma, on the steps of the Union Buildings upon their arrival in Pretoria, South Africa, on Saturday June 29. Hide Caption 12 of 26 Photos: Obama's tour of Africa 26 photos Obama's tour of Africa – Obama answers a question during a town hall meeting at the University of Johannesburg Soweto in Johannesburg, South Africa, on June 29. Hide Caption 13 of 26 Photos: Obama's tour of Africa 26 photos Obama's tour of Africa – Obama and Zuma speak during a press conference at the Union Buildings in Pretoria, South Africa, on June 29. Hide Caption 14 of 26 Photos: Obama's tour of Africa 26 photos Obama's tour of Africa – Marine One takes off as the Obamas leave the Union Buildings on June 29 in Pretoria. Hide Caption 15 of 26 Photos: Obama's tour of Africa 26 photos Obama's tour of Africa – Michelle Obama participates in a discussion with students on the importance of education June 29 at the Sci-Bono Discovery Centre in Johannesburg. Hide Caption 16 of 26 Photos: Obama's tour of Africa 26 photos Obama's tour of Africa – USAID administrator Rajiv Shah, left, looks on as Obama talks to Nimna Diayte, president of the Farmers Federation, during a food security expo on Friday, June 28, in Dakar, Senegal. Obama met with farmers, innovators, and entrepreneurs whose new methods and technologies are improving the lives of smallholder farmers throughout West Africa. Hide Caption 17 of 26 Photos: Obama's tour of Africa 26 photos Obama's tour of Africa – Obama shows the White House press corps what rice looks like before it's threshed on June 28 in Dakar. Hide Caption 18 of 26 Photos: Obama's tour of Africa 26 photos Obama's tour of Africa – Obama toasts with Senegalese President Macky Sall during an official dinner at the Presidential Palace in Dakar on Thursday, June 27. Hide Caption 19 of 26 Photos: Obama's tour of Africa 26 photos Obama's tour of Africa – Barack and Michelle Obama look out from the Door of No Return while touring the House of Slaves at Goree Island off the coast of Dakar, Senegal, on Thursday, June 27. Hide Caption 20 of 26 Photos: Obama's tour of Africa 26 photos Obama's tour of Africa – Senegal's President Macky Sall, right, and Sall's wife, Marieme Faye Sall, left, welcome the president and first lady as they arrive at the presidential palace prior to meetings in Dakar on June 27. Hide Caption 21 of 26 Photos: Obama's tour of Africa 26 photos Obama's tour of Africa – President Obama reviews an honor guard outside the presidential palace in Dakar on June 27. Hide Caption 22 of 26 Photos: Obama's tour of Africa 26 photos Obama's tour of Africa – Obama talks with Sall during a bilateral press conference on June 27. Hide Caption Photos: Obama's tour of Africa 26 photos Obama's tour of Africa – Obama and Sall walk to a press conference. Hide Caption Photos: Obama's tour of Africa 26 photos Obama's tour of Africa – Obama talks on June 27 during a press conference. Hide Caption 25 of 26 Photos: Obama's tour of Africa 26 photos Obama's tour of Africa – Obama speaks with locals as he tours Goree Island off the coast of Dakar on June 27. Hide Caption 26 of 26 Washington (CNN) The White House announced Friday that President Barack Obama with travel to Ethiopia late next month, the first sitting U.S. President to do so. While in Ethiopia, Obama will participate in bilateral meetings with the Governments of Ethiopia and with the leadership of the African Union This visit \"will build on the success of the August 2014 U.S.-Africa Leaders Summit by strengthening ties with our African partners and highlighting America's longstanding commitment to investing in Africa,\" said Press Secretary Josh Earnest in a statement. President Obama will also be the first sitting U.S. President to visit the African Union headquarters. In late July, Obama will travel to his father's native country, Kenya, before he heads to Ethiopia — for bilateral meetings and the 2015 Global Entrepreneurship Summit — an annual conference that aims to connect entrepreneurs with various organizations, governments and business leaders. This trip will be Obama's first trip as President to Kenya. This summer's trip will be the President's fourth visit to Africa. He was last there in December 2013 attending the funeral of Nelson Mandela.", "external_links": [], "published": "2015-06-19T21:01:00.000+03:00", "crawled": "2015-06-19T21:35:47.000+03:00", "highlightTitle": "", "social": {"gplus": {"shares": 0}, "pinterest": {"shares": 0}, "vk": {"shares": 0}, "linkedin": {"shares": 0}, "facebook": {"likes": 0, "shares": 0, "comments": 0}, "stumbledupon": {"shares": 0}}}