{"organizations": ["Free Syrian Army", "Mossad", "U.S. Air Force", "ISIS", "Steven Joel Sotloff Memorial Foundation", "Zakho Emergency Hospital", "National Security Council", "Time magazine", "People's Protection Unit", "U.S. Navy", "Iraqi Air Force", "Al-Alam"], "uuid": "93adcda6c6b20d695837f6986204ecd662143603", "thread": {"site_full": "edition.cnn.com", "main_image": "http://i2.cdn.turner.com/cnnnext/dam/assets/150528142544-steven-sotloff-large-169.jpg", "site_section": "http://rss.cnn.com/rss/cnn_allpolitics.rss&author=CNN&title=Politics", "section_title": "CNN.com - Politics", "url": "http://edition.cnn.com/2015/05/28/politics/koch-brothers-2016/index.html", "country": "US", "title": "Obama meets family of journalist beheaded by ISIS", "performance_score": 0, "site": "cnn.com", "participants_count": 0, "title_full": "Obama meets family of journalist beheaded by ISIS", "spam_score": 0.0, "site_type": "news", "published": "2015-05-28T21:26:00.000+03:00", "replies_count": 0, "uuid": "9d47d7a05303ac93e9a0cc34f494d068fc603a88"}, "author": "", "url": "http://edition.cnn.com/2015/05/28/politics/obama-meets-sotloff-family-isis-beheading/index.html", "ord_in_thread": 0, "title": "Obama meets family of journalist beheaded by ISIS", "locations": ["Altun Kupri", "Afghanistan", "Phoenix", "Baghdad", "Iraq", "Khazair", "Jordan", "Euphrates River", "Mount Sinjar", "Baqufa", "Kobani", "Feeshkhabour", "Miami", "Tokyo", "Turkey", "Ramadi", "Garma", "Jalalabad", "Sadiyah", "U.S.", "Suruc", "Tikrit", "Qatif", "Mosul", "United States", "Jurf al-Sakhar", "Karak", "Kirkuk", "Saudi Arabia", "Yazidi", "Syria", "Israel", "Baiji", "Kabul Bank", "Turkey-Syria", "Mount Zardak", "Mursitpinar", "Celavle", "Douma", "East Jerusalem", "Washington", "Damascus", "Duhuk", "Najaf", "Persian Gulf", "Sotloff", "Irbil", "Anbar", "Zumar", "Diyala"], "entities": {"persons": [], "locations": [], "organizations": []}, "highlightText": "", "language": "english", "persons": ["Mueller", "Kayla Mueller", "Barack Obama", "Goto", "Kenji Goto", "Moath al-Kasasbeh", "Saddam Hussein", "Musallam", "Kiymet Ergun", "Haruna Yukawa", "Sotloff", "Mohammed Musallam", "Obama", "Safi al-Kasasbeh", "Steven Sotloff", "Steven", "Al-Kasasbeh", "Meehan", "Cundi Minaz", "Minaz", "Junko Ishido", "Kobani", "Bernadette Meehan", "Neve Yaakov", "Aziza Hamid"], "text": "CNN.com <div class=\"banner\" id=\"cnn_300x250_sync_freewheel-rail_0_banner\"><span id=\"cnn_300x250_sync_freewheel-rail_0\" class=\"_fwph\"><form id=\"_fw_form_cnn_300x250_sync_freewheel-rail_0\" style=\"display:none\"><input type=\"hidden\" name=\"_fw_input_cnn_300x250_sync_freewheel-rail_0\" id=\"_fw_input_cnn_300x250_sync_freewheel-rail_0\" value=\"ptgt=s&envp=g_js&w=300&h=250&slau=300x250_sync&adUnit=300x250_sync\"></form><span id=\"_fw_container_cnn_300x250_sync_freewheel-rail_0\" class=\"cn-shingle__ad\"></span></span></div> <div id=\"ad_bnr_atf_01\" class=\"ad-ad_bnr_atf_01\"></div> Obama meets family of journalist beheaded by ISIS Updated 1927 GMT (0227 HKT) May 28, 2015 JUST WATCHED Sotloff's father: 'My heart is broken' 01:09 Washington (CNN) President Barack Obama met Thursday with the family of an American killed by ISIS, visiting the parents and sister of journalist Steven Sotloff during a trip to Miami. Sotloff was beheaded by ISIS in September, and the terror group's decision to release a video of his death increased the attention -- and news coverage -- that its march through Iraq and Syria has received in the United States. National Security Council spokeswoman Bernadette Meehan said Obama \"expressed his and the first lady's condolences for Steven's death.\" The ISIS terror threat 69 photos The ISIS terror threat 69 photos People search through debris after an explosion at a Shiite mosque in Qatif, Saudi Arabia, on Friday, May 22. The militant group ISIS has claimed responsibility for the attack, according to tweets from ISIS supporters, which included a formal statement from ISIS detailing the operation. Hide Caption 1 of 69 The ISIS terror threat 69 photos Iraqi security forces withdraw from Ramadi, the capital of Iraq's Anbar province, on Sunday, May 17. ISIS took control of the city , according to the city's mayor and a high-ranking security official. The aim of ISIS is to create an Islamic state across Sunni areas of Iraq and Syria. Hide Caption 2 of 69 The ISIS terror threat 69 photos A car bomb, believed to be set by ISIS militants, explodes at the gate of a government building near the provincial governor's compound in Ramadi on Saturday, May 16. Hide Caption 3 of 69 The ISIS terror threat 69 photos Iraqi soldiers fire their weapons toward ISIS group positions in the Garma district, west of the Iraqi capital of Baghdad, on Sunday, April 26. Pro-government forces said they had recently made advances on areas held by Islamist jihadists. Hide Caption 4 of 69 The ISIS terror threat 69 photos A member of Afghanistan's security forces stands at the site where a suicide bomber on a motorbike blew himself up in front of the Kabul Bank in Jalalabad, Afghanistan, on April 18. ISIS claimed responsibility for the attack. The explosion killed at least 33 people and injured more than 100 others, a public health spokesman said. Hide Caption 5 of 69 The ISIS terror threat 69 photos Iraqi counterterrorism forces patrol in Ramadi on April 18. Iraqi special forces maintained control of the provincial capital after days of intense clashes with ISIS left the city at risk. Hide Caption 6 of 69 The ISIS terror threat 69 photos Thousands of Iraqis cross a bridge over the Euphrates River to Baghdad, as they flee Ramadi on Friday, April 17. Hide Caption 7 of 69 The ISIS terror threat 69 photos Iraqi security forces and tribal fighters gather before attacking ISIS militants in Ramadi on Wednesday, April 15. Hide Caption 8 of 69 The ISIS terror threat 69 photos People leave their hometown of Ramadi on April 15. ISIS' offensive in Ramadi shows its resilience despite months of U.S.-led airstrikes and a recent defeat in the northern city of Tikrit. Hide Caption The ISIS terror threat 69 photos Security forces arrive to Ramadi to join the battle against ISIS on April 15. Hide Caption 10 of 69 The ISIS terror threat 69 photos Yazidis embrace after being released by ISIS south of Kirkuk, Iraq, on Wednesday, April 8. ISIS released more than 200 Yazidis , a minority group whose members were killed, captured and displaced when the Islamist terror organization overtook their towns in northern Iraq last summer, officials said. Hide Caption 11 of 69 The ISIS terror threat 69 photos Kurdish Peshmerga forces help Yazidis as they arrive at a medical center in Altun Kupri, Iraq, on April 8. Hide Caption 12 of 69 The ISIS terror threat 69 photos A Yazidi woman mourns for the death of her husband and children by ISIS after being released south of Kirkuk on April 8. Hide Caption 13 of 69 The ISIS terror threat 69 photos Security forces in Tikrit chant slogans against the ISIS militant group on Friday, April 3. They had just reopened the main gate of their base, which was closed for months while ISIS occupied the city. Hide Caption 14 of 69 The ISIS terror threat 69 photos People in Tikrit inspect what used to be a palace of former President Saddam Hussein on April 3. Hide Caption 15 of 69 The ISIS terror threat 69 photos A member of Iraq's security forces beats a suspected ISIS member who was captured in Tikrit on Wednesday, April 1. Hide Caption 16 of 69 The ISIS terror threat 69 photos On April 1, Shiite militiamen celebrate the retaking of Tikrit, which had been under ISIS control since June. The push into Tikrit came days after U.S.-led airstrikes targeted ISIS bases around the city. Hide Caption 17 of 69 The ISIS terror threat 69 photos Iraqi security forces and Shiite militiamen prepare to attack ISIS militants in Tikrit on Tuesday, March 31. Ousting ISIS from Tikrit was an important step for the coalition, which is trying to thwart the extremist group's quest to grow its caliphate. Hide Caption The ISIS terror threat 69 photos Iraqi security forces launch a rocket against ISIS positions in Tikrit on Monday, March 30. Hide Caption The ISIS terror threat 69 photos An Iraqi soldier searches for ISIS fighters in Tikrit on March 30. Hide Caption 20 of 69 The ISIS terror threat 69 photos An Iraqi soldier takes photos of the demolished tomb of former Iraqi President Saddam Hussein on Sunday, March 15. The tomb in Tikrit was destroyed as Iraqi forces battled ISIS for control of the city. Hide Caption 21 of 69 The ISIS terror threat 69 photos Smoke billows after a mortar shell hit an Anbar governorate building in Ramadi, Iraq, on Wednesday, March 11. ISIS launched a coordinated attack on government-held areas of the western Iraqi city. Hide Caption 22 of 69 The ISIS terror threat 69 photos The parents of 19-year-old Mohammed Musallam react at the family's home in the East Jerusalem Jewish settlement of Neve Yaakov on Tuesday, March 10. ISIS released a video purportedly showing a young boy executing Musallam, an Israeli citizen of Palestinian descent who ISIS claimed infiltrated the group in Syria to spy for the Jewish state. Musallam's family told CNN that he had no ties with the Mossad, Israel's spy agency, and had, in fact, been recruited by ISIS. Hide Caption 23 of 69 The ISIS terror threat 69 photos Iraqi Shiite fighters cover their ears as a rocket is launched during a clash with ISIS militants in the town of Al-Alam, Iraq, on Monday, March 9. Hide Caption 24 of 69 The ISIS terror threat 69 photos Displaced Assyrian women who fled their homes due to ISIS attacks pray at a church on the outskirts of Damascus, Syria, on Sunday, March 1. ISIS militants recently abducted at least 220 Assyrians in Syria. Hide Caption 25 of 69 The ISIS terror threat 69 photos Safi al-Kasasbeh, right, receives condolences from tribal leaders at his home village near Karak, Jordan, on Wednesday, February 4. Al-Kasasbeh's son, Jordanian pilot Moath al-Kasasbeh, was burned alive in a video that was recently released by ISIS militants. Jordan is one of a handful of Middle Eastern nations taking part in the U.S.-led military coalition against ISIS. Hide Caption 26 of 69 The ISIS terror threat 69 photos A Kurdish marksman looks over a destroyed area of Kobani on Friday, January 30, after the city had been liberated from the ISIS militant group. The Syrian city, also known as Ayn al-Arab, had been under assault by ISIS since mid-September. Hide Caption 27 of 69 The ISIS terror threat 69 photos Smoke billows in Kirkuk as Kurdish Peshmerga fighters take position against ISIS militants on January 30. Hide Caption 28 of 69 The ISIS terror threat 69 photos Kurdish people celebrate in Suruc, Turkey, near the Turkish-Syrian border, after ISIS militants were expelled from Kobani on Tuesday, January 27. Hide Caption 29 of 69 The ISIS terror threat 69 photos Collapsed buildings are seen in Kobani on January 27 after Kurdish forces took control of the town from ISIS. Hide Caption 30 of 69 The ISIS terror threat 69 photos Junko Ishido, mother of Japanese journalist Kenji Goto, reacts during a news conference in Tokyo on Friday, January 23. ISIS would later kill Goto and another Japanese hostage, Haruna Yukawa. Hide Caption 31 of 69 The ISIS terror threat 69 photos ISIS militants are seen through a rifle's scope during clashes with Peshmerga fighters in Mosul, Iraq, on Wednesday, January 21. Hide Caption 32 of 69 The ISIS terror threat 69 photos An elderly Yazidi man arrives in Kirkuk after being released by ISIS on Saturday, January 17. The militant group released about 200 Yazidis who were held captive for five months in Iraq. Almost all of the freed prisoners were in poor health and bore signs of abuse and neglect, Kurdish officials said. Hide Caption 33 of 69 The ISIS terror threat 69 photos Smoke billows behind an ISIS sign during an Iraqi military operation to regain control of the town of Sadiyah, about 95 kilometers (60 miles) north of Baghdad, on Tuesday, November 25. Hide Caption 34 of 69 The ISIS terror threat 69 photos Fighters from the Free Syrian Army and the Kurdish People's Protection Units join forces to fight ISIS in Kobani on Wednesday, November 19. Hide Caption 35 of 69 The ISIS terror threat 69 photos A picture taken from Turkey shows smoke rising after ISIS militants fired mortar shells toward an area controlled by Syrian Kurdish fighters near Kobani on Monday, November 3. Hide Caption 36 of 69 The ISIS terror threat 69 photos Iraqi special forces search a house in Jurf al-Sakhar, Iraq, on Thursday, October 30, after retaking the area from ISIS. Hide Caption 37 of 69 The ISIS terror threat 69 photos ISIS militants stand near the site of an airstrike near the Turkey-Syria border on Thursday, October 23. The United States and several Arab nations have been bombing ISIS targets in Syria to take out the militant group's ability to command, train and resupply its fighters. Hide Caption 38 of 69 The ISIS terror threat 69 photos Kurdish fighters walk to positions as they combat ISIS forces in Kobani on Sunday, October 19. Hide Caption The ISIS terror threat 69 photos A U.S. Air Force plane flies above Kobani on Saturday, October 18. Hide Caption The ISIS terror threat 69 photos Heavy smoke rises in Kobani following an airstrike by the U.S.-led coalition on October 18. Hide Caption 41 of 69 The ISIS terror threat 69 photos Cundi Minaz, a female Kurdish fighter, is buried in a cemetery in the southeastern Turkish town of Suruc on Tuesday, October 14. Minaz was reportedly killed during clashes with ISIS militants in nearby Kobani. Hide Caption 42 of 69 The ISIS terror threat 69 photos Turkish police officers secure a basketball stadium in Suruc on October 14. Some Syrian Kurds were held there after crossing from Syria into Turkey. Tens of thousands of people fled Kobani to escape ISIS. Hide Caption 43 of 69 The ISIS terror threat 69 photos Kiymet Ergun, a Syrian Kurd, celebrates in Mursitpinar, Turkey, after an airstrike by the U.S.-led coalition in Kobani on Monday, October 13. Hide Caption 44 of 69 The ISIS terror threat 69 photos Alleged ISIS militants stand next to an ISIS flag atop a hill in Kobani on Monday, October 6. Hide Caption 45 of 69 The ISIS terror threat 69 photos In this photo released by the U.S. Air Force on Saturday, October 4, a U.S. Navy jet is refueled in Iraqi airspace after conducting an airstrike against ISIS militants. Hide Caption 46 of 69 The ISIS terror threat 69 photos A Kurdish Peshmerga soldier who was wounded in a battle with ISIS is wheeled to the Zakho Emergency Hospital in Duhuk, Iraq, on Tuesday, September 30. Hide Caption 47 of 69 The ISIS terror threat 69 photos Syrian Kurds wait near a border crossing in Suruc as they wait to return to their homes in Kobani on Sunday, September 28. Hide Caption 48 of 69 The ISIS terror threat 69 photos Tomahawk missiles, intended for ISIS targets in Syria, fly above the Persian Gulf after being fired by the USS Philippine Sea in this image released by the U.S. Navy on Tuesday, September 23. Hide Caption 49 of 69 The ISIS terror threat 69 photos Turkish Kurds clash with Turkish security forces during a protest near Suruc on Monday, September 22. According to Time magazine , the protests were over Turkey's temporary decision to close the border with Syria. Hide Caption The ISIS terror threat 69 photos Syrian Kurds fleeing ISIS militants wait behind a fence in Suruc on Sunday, September 21. Hide Caption 51 of 69 The ISIS terror threat 69 photos A elderly man is carried after crossing the Syria-Turkey border near Suruc on Saturday, September 20. Hide Caption 52 of 69 The ISIS terror threat 69 photos A Kurdish Peshmerga fighter launches mortar shells toward ISIS militants in Zumar, Iraq, on Monday, September 15. Hide Caption 53 of 69 The ISIS terror threat 69 photos Kurdish Peshmerga fighters fire at ISIS militant positions from their position on the top of Mount Zardak, east of Mosul, Iraq, on Tuesday, September 9. Hide Caption 54 of 69 The ISIS terror threat 69 photos Kurdish Peshmerga forces stand guard at their position in the Omar Khaled village west of Mosul on Sunday, August 24. Hide Caption 55 of 69 The ISIS terror threat 69 photos Kurdish Peshmergas fight to regain control of the town of Celavle, in Iraq's Diyala province, on August 24. Hide Caption 56 of 69 The ISIS terror threat 69 photos Peshmerga fighters stand guard at Mosul Dam in northern Iraq on Thursday, August 21. With the help of U.S. military airstrikes, Kurdish and Iraqi forces retook the dam from ISIS militants on August 18. A breach of the dam would have been catastrophic for millions of Iraqis who live downstream from it. Hide Caption 57 of 69 The ISIS terror threat 69 photos Displaced Iraqis receive clothes from a charity at a refugee camp near Feeshkhabour, Iraq, on Tuesday, August 19. Hide Caption 58 of 69 The ISIS terror threat 69 photos Peshmerga fighters inspect the remains of a car that reportedly belonged to ISIS militants and was targeted by a U.S. airstrike in the village of Baqufa, north of Mosul, on August 18. Hide Caption The ISIS terror threat 69 photos Kurdish Peshmerga fighters fire at ISIS in Khazair, Iraq, on Thursday, August 14. Hide Caption 60 of 69 The ISIS terror threat 69 photos Aziza Hamid, a 15-year-old Iraqi girl, cries for her father while she and some other Yazidi people are flown to safety Monday, August 11, after a dramatic rescue operation at Iraq's Mount Sinjar. A CNN crew was on the flight, which took diapers, milk, water and food to the site where as many as 70,000 people were trapped by ISIS. But only a few of them were able to fly back on the helicopter with the Iraqi Air Force and Kurdish Peshmerga fighters. Hide Caption 61 of 69 The ISIS terror threat 69 photos Thousands of Yazidis are escorted to safety by Kurdish Peshmerga forces and a People's Protection Unit in Mosul on Saturday, August 9. Hide Caption 62 of 69 The ISIS terror threat 69 photos Thousands of Yazidi and Christian people flee Mosul on Wednesday, August 6, after the latest wave of ISIS advances. Hide Caption 63 of 69 The ISIS terror threat 69 photos A Baiji oil refinery burns after an alleged ISIS attack in northern Selahaddin, Iraq, on Thursday, July 31. Hide Caption 64 of 69 The ISIS terror threat 69 photos A Syrian rebel fighter lies on a stretcher at a makeshift hospital in Douma, Syria, on Wednesday, July 9. He was reportedly injured while fighting ISIS militants. Hide Caption 65 of 69 The ISIS terror threat 69 photos New army recruits gather in Najaf, Iraq, on Wednesday, June 18, following a call for Iraqis to take up arms against Islamic militant fighters. Hide Caption 66 of 69 The ISIS terror threat 69 photos Kurdish Peshmerga forces, along with Iraqi special forces, deploy their troops and armored vehicles outside of Kirkuk, Iraq, on June 12. Hide Caption 67 of 69 The ISIS terror threat 69 photos Children stand next to a burnt vehicle during clashes between Iraqi security forces and ISIS militants in Mosul on Tuesday, June 10. Hide Caption The ISIS terror threat 69 photos Civilians from Mosul escape to a refugee camp near Irbil, Iraq, on June 10. Hide Caption 69 of 69 EXPAND GALLERY \"He appreciated the chance to hear from the Sotloffs more about Steven's work as a journalist, including his passion for bringing the stories of people who are suffering to the rest of the world in the hope of making a positive difference, including in Syria,\" Meehan said. She said Obama also recognized the family's foundation set up in Sotloff's memory to support journalists who are reporting from conflict zones, called \"2Lives: Steven Joel Sotloff Memorial Foundation.\" Earlier this year, Obama met with the family of Kayla Mueller during a visit to Phoenix. Mueller, a 26-year-old aid worker, was killed while being held by ISIS in Syria, and her death was made public in February. <div id=\"ad_rect_atf_01\" class=\"ad-ad_rect_atf_01\"></div> More from Politics", "external_links": [], "published": "2015-05-28T21:26:00.000+03:00", "crawled": "2015-05-28T21:54:15.000+03:00", "highlightTitle": "", "social": {"gplus": {"shares": 0}, "pinterest": {"shares": 0}, "vk": {"shares": 0}, "linkedin": {"shares": 0}, "facebook": {"likes": 0, "shares": 0, "comments": 0}, "stumbledupon": {"shares": 0}}}