{"organizations": ["Florida State Cabinet", "Fox News", "Republican", "George Bush Library", "U.S. Army Golden Knights", "House Committee on Homeland Security", "Latin American Chamber of Commerce", "American College of Cardiology Annual Convention", "Tampa Bay Times Forum", "Lincoln Center", "The Country Club", "Lincoln Center Institute Gala", "Chicago Council"], "uuid": "f29f3e938ebc92f664d15a83b5f491f5fa865a46", "thread": {"site_full": "edition.cnn.com", "main_image": "http://i2.cdn.turner.com/cnnnext/dam/assets/150506085417-jeb-bush-in-washington-dc--april-2015-large-169.jpg", "site_section": "http://rss.cnn.com/rss/cnn_latest.rss", "section_title": "CNN.com Recently Published/Updated", "url": "http://edition.cnn.com/2015/05/10/politics/illness-cuts-jimmy-carter-trip-short/index.html", "country": "US", "title": "Jeb Bush on immigration: 'People can be persuaded'", "performance_score": 0, "site": "cnn.com", "participants_count": 0, "title_full": "Jeb Bush on immigration: 'People can be persuaded'", "spam_score": 0.0, "site_type": "news", "published": "2015-05-10T18:45:00.000+03:00", "replies_count": 0, "uuid": "0e971ce81d105ca520b8b3260713a53069ff6838"}, "author": "", "url": "http://edition.cnn.com/2015/05/10/politics/jeb-bush-immigration-scott-walker-election-2016/index.html", "ord_in_thread": 0, "title": "Jeb Bush on immigration: 'People can be persuaded'", "locations": ["Quito", "Tampa", "Chicago", "Florida", "Orlando", "Plant City", "Massachusetts", "Coral Gables", "Tallahassee", "Orlando International Airport", "Brandon", "Maryland", "Kennebunkport", "Miami", "Washington", "West Wing", "Everglades", "Texas", "Little Havana", "New York City", "U.S.", "Brazil", "Brookline", "Maine", "National Harbor", "Florida State Fairgrounds", "Brasilia", "CAMACOL"], "entities": {"persons": [], "locations": [], "organizations": []}, "highlightText": "", "language": "english", "persons": ["Frederick P. Rose Hall", "Jenna", "Jeb Bush", "Vincente Fox", "Barack Obama", "Bush", "George Bush", "Bill Clinton", "George W. Bush", "Margaret", "Marvin Bush", "Megyn Kelly", "Columba Bush", "Barbara", "Hillary Clinton", "Pierce", "George H.W. Bush", "George H.W.", "Jeb", "Marshall", "Fox", "Rick Perry", "Neil Bush", "Janet Napolitano", "George P. (Jeb", "Doro Bush Lebond", "Bill LeBlond", "Barbara Bush", "Sharon", "Sam LeBlond", "Jose Alancar", "George W.", "Laura Bush", "Jebby", "Noelle Bush"], "text": "CNN.com <div class=\"banner\" id=\"cnn_300x250_sync_freewheel-rail_0_banner\"><span id=\"cnn_300x250_sync_freewheel-rail_0\" class=\"_fwph\"><form id=\"_fw_form_cnn_300x250_sync_freewheel-rail_0\" style=\"display:none\"><input type=\"hidden\" name=\"_fw_input_cnn_300x250_sync_freewheel-rail_0\" id=\"_fw_input_cnn_300x250_sync_freewheel-rail_0\" value=\"ptgt=s&envp=g_js&w=300&h=250&slau=300x250_sync&adUnit=300x250_sync\"></form><span id=\"_fw_container_cnn_300x250_sync_freewheel-rail_0\" class=\"cn-shingle__ad\"></span></span></div> Jeb Bush on immigration: 'People can be persuaded' Updated 1645 GMT (2345 HKT) May 10, 2015 Jeb Bush's life 20 photos Former Florida governor Jeb Bush shakes hands with attendees after speaking at the 42nd annual Conservative Political Action Conference February 27, 2015 in National Harbor, Maryland. Hide Caption 1 of 20 Jeb Bush's life 20 photos Bush takes a selfie with a guest at a luncheon hosted by the Chicago Council on Global Affairs on February 18, 2015, in Chicago. Bush delivered his first major foreign policy speech at the event. Hide Caption 2 of 20 Jeb Bush's life 20 photos Bush hands out items for Holiday Food Baskets to those in need outside the Little Havana offices of CAMACOL, the Latin American Chamber of Commerce on December 17, 2014, in Miami. Hide Caption 3 of 20 Jeb Bush's life 20 photos Bush waves to the audience at the Tampa Bay Times Forum in Tampa, Florida, on August 30, 2012, on the final day of the Republican National Convention. Hide Caption 4 of 20 Jeb Bush's life 20 photos Bush (left) and wife Columba Bush attend the 2012 Lincoln Center Institute Gala at Frederick P. Rose Hall, Jazz at Lincoln Center on March 7, 2012, in New York City. Hide Caption 5 of 20 Jeb Bush's life 20 photos President Barack Obama (left) speaks about Bush (center) while visiting Miami Central Senior High School on March 4, 2011 in Miami, Florida. The visit focused on education. Hide Caption 6 of 20 Jeb Bush's life 20 photos Bush (left) speaks with Brazilian President in charge Jose Alancar during a meeting at Planalto Palace in Brasilia, April 17, 2007. Bush was in Brazil to speak about sugar and ethanol business. Hide Caption 7 of 20 Jeb Bush's life 20 photos Then-Texas Governor Rick Perry (center) testifies as Bush (right) and then-Arizona Governor Janet Napolitano (left) listen during a hearing before the House Committee on Homeland Security on Capitol Hill October 19, 2005. Hide Caption 8 of 20 Jeb Bush's life 20 photos Bush gives a thumbs up signal from his car as he leaves a local polling station after casting his vote in Coral Gables, Florida, November 5, 2002. Hide Caption 9 of 20 Jeb Bush's life 20 photos Bush walks out of the West Wing after meeting with his brother, then-President George W. Bush, at the White House January 9, 2002. Governor Bush participated in the signing ceremony of the Everglades Protection Agreement. Hide Caption 10 of 20 Jeb Bush's life 20 photos Then-Mexican President Vincente Fox (left) and Bush hold a press conference September 7, 2001, in Miami. Fox visited Florida to attend the Americas Conference and deliver a speech to speak about issues such as immigration. Hide Caption 11 of 20 Jeb Bush's life 20 photos Then-President George W. Bush (right) is greeted by Jeb Bush on March 21, 2001, at Orlando International Airport in Orlando, Florida. President Bush was in Orlando to attend the American College of Cardiology Annual Convention. Hide Caption 12 of 20 Jeb Bush's life 20 photos Bush speaks during a press conference at the Carandolet Government Palace in Quito, January 18, 2006. Bush and a businessmen delegation were in a two-day visit to talk about a free trade agreement. Hide Caption 13 of 20 Jeb Bush's life 20 photos Bush speaks to reporters after meeting with the Florida State Cabinet at the Florida State Capitol Building November 16, 2000, in Tallahassee, Florida. Hide Caption 14 of 20 Jeb Bush's life 20 photos Then-President George W. Bush (left) and Jeb Bush (right), raise their arms onstage following a rally at the Florida State Fairgrounds, October 25, 2000, in Brandon, Florida. Hide Caption 15 of 20 Jeb Bush's life 20 photos Jeb Bush (left) and then-President George W. Bush stand with their arms around each other's shoulders at a rally in Miami, Florida, September 22, 2000. Hide Caption 16 of 20 Jeb Bush's life 20 photos Then-President George W. Bush (right) and Jeb Bush go through the line for strawberries during a stop at the Stawberry Festival March 12, 2000 in Plant City, Florida. Hide Caption 17 of 20 Jeb Bush's life 20 photos The Bush family, (left to right) former U.S. President George W., former Florida Governor Jeb, former President George H.W. and his wife Barbara, watch play during the Foursomes matches September 25, 1999 at The Country Club in Brookline, Massachusetts the site of the 33rd Ryder Cup Matches. Hide Caption 18 of 20 Jeb Bush's life 20 photos Former President George H.W. Bush (second left), his wife Barbara Bush (left), their son Jeb Bush (center), then-first lady Hillary Clinton (second right), and former then-President Bill Clinton (right) look up to see the U.S. Army Golden Knights parachute team November 6, 1997 at the conclusion of the dedication ceremony of the George Bush Library in College Station, Texas. Hide Caption 19 of 20 Jeb Bush's life 20 photos Portrait of the Bush family in front of their Kennebunkport, Maine house August 24, 1986. Pictured, back row: Margaret holding daughter Marshall, Marvin Bush, Bill LeBlond. Pictured, front row: Neil Bush holding son Pierce, Sharon, George W. Bush holding daughter Barbara, Laura Bush holding daughter Jenna, Barbara Bush, George Bush, Sam LeBlond, Doro Bush Lebond, George P. (Jeb's son), Jeb Bush holding son Jebby, Columba Bush and Noelle Bush. Hide Caption 20 of 20 Washington (CNN) Jeb Bush says he thinks he can sell the Republican base on his position on immigration -- and he's hitting opponents who have changed their positions on the issue. \"I get a sense that a lot of people can be persuaded, to be honest with you,\" the former Florida governor told Fox News in a preview of his interview with host Megyn Kelly that aired Sunday. Bush has urged a respectful tone toward undocumented immigrants and has said it should be easier for those immigrants to gain legal status. JUST WATCHED", "external_links": [], "published": "2015-05-10T18:45:00.000+03:00", "crawled": "2015-05-10T21:06:37.000+03:00", "highlightTitle": "", "social": {"gplus": {"shares": 0}, "pinterest": {"shares": 0}, "vk": {"shares": 0}, "linkedin": {"shares": 0}, "facebook": {"likes": 0, "shares": 0, "comments": 0}, "stumbledupon": {"shares": 0}}}