{"organizations": ["Time Magazine", "Harvard Law Review", "Republican", "Lansing Center", "Columbia University", "U.S. House", "Barack Obama Foundation", "University of Chicago Law School", "Harvard University", "ABC", "Senate", "U.K. Parliament", "White House", "Stanley Ann", "U.S. Senate", "Time Warner Cable Arena", "AP", "FEC"], "uuid": "1c623b38d137b88f6e098f2e6c666c18e42482b9", "thread": {"site_full": "edition.cnn.com", "main_image": "", "site_section": "http://rss.cnn.com/rss/cnn_latest.rss\r", "section_title": "CNN.com Recently Published/Updated", "url": "http://edition.cnn.com/2015/05/12/politics/obama-presidential-library-chicago-announcement/index.html", "country": "US", "title": "Barack Obama Fast Facts", "performance_score": 0, "site": "cnn.com", "participants_count": 0, "title_full": "Barack Obama Fast Facts", "spam_score": 0.0, "site_type": "news", "published": "2015-05-12T22:07:00.000+03:00", "replies_count": 0, "uuid": "f79603c40a37116e0d4d12dc39b14ee44ac75384"}, "author": "", "url": "http://edition.cnn.com/2012/12/26/us/barack-obama---fast-facts/index.html", "ord_in_thread": 0, "title": "Barack Obama Fast Facts", "locations": ["United States", "Cuba", "Lansing", "Indonesia", "Springfield", "Chicago", "Afghanistan", "Nyangoma-Kogelo", "Iowa", "Charlotte", "Iraq", "Kenya", "Jordan", "Maryland", "Guantanamo Bay", "Hawaii Birth", "US", "Pakistan", "Washington", "Illinois", "Philadelphia", "DC", "Hawaii", "Turkey", "Abbottabad", "Israeli", "Honolulu", "Montana", "U.S.", "North Carolina", "Michigan", "Swahili", "South Dakota"], "entities": {"persons": [], "locations": [], "organizations": []}, "highlightText": "", "language": "english", "persons": ["al Qaeda", "Obama Soetoro", "Malia", "Barack Obama", "Natasha", "Alan Keyes", "Bill Clinton", "Michelle", "Benjamin Netanyahu", "Jeremiah Wright", "Barack Hussein Obama", "Helen Thomas", "Mahmoud Abbas", "Kennedy", "Osama bin Laden", "Biden", "Joseph Biden", "Soetoro", "Jimmy Carter", "Dunham", "Mitt Romney", "Bobby Rush", "Barack", "Obama", "Herbie Hancock", "Hosni Mubarak", "J.D.", "Madelyn Dunham", "Lolo Soetoro"], "text": "CNN Leadership <div class=\"banner\" id=\"cnn_300x250_sync_freewheel-rail_0_banner\"><span id=\"cnn_300x250_sync_freewheel-rail_0\" class=\"_fwph\"><form id=\"_fw_form_cnn_300x250_sync_freewheel-rail_0\" style=\"display:none\"><input type=\"hidden\" name=\"_fw_input_cnn_300x250_sync_freewheel-rail_0\" id=\"_fw_input_cnn_300x250_sync_freewheel-rail_0\" value=\"ptgt=s&envp=g_js&w=300&h=250&slau=300x250_sync&adUnit=300x250_sync\"></form><span id=\"_fw_container_cnn_300x250_sync_freewheel-rail_0\" class=\"cn-shingle__ad\"></span></span></div> Barack Obama Fast Facts Updated 2007 GMT (0307 HKT) May 12, 2015 Obama turns 53 years old 7 photos Obama turns 53 years old – Democratic presidential candidate Barack Obama smiles and waves as the crowd sings \"Happy Birthday\" to him before his speech at the Lansing Center in Lansing, Michigan, on August 4, 2008. Hide Caption 1 of 7 Obama turns 53 years old 7 photos Obama turns 53 years old – Reporter Helen Thomas celebrates her 89th birthday with President Barack Obama, celebrating his 48th birthday, at the White House. Hide Caption 2 of 7 Obama turns 53 years old 7 photos Obama turns 53 years old – President Barack Obama reacts as the audience sings \"Happy Birthday\" after he presented the 2010 Citizens Medals at the White House. (AP Photo/Charles Dharapak) Hide Caption 3 of 7 Obama turns 53 years old 7 photos Obama turns 53 years old – Jazz musician Herbie Hancock, left, and members of OK-go are onstage as President Barack Obama celebrates his 50th birthday in Chicago in August 2011. Hide Caption 4 of 7 Obama turns 53 years old 7 photos Obama turns 53 years old – President Barack Obama walking from Marine One upon his return to the White House in August 2012 following a visit to Camp David, Maryland, where he spent his 51st birthday. Hide Caption 5 of 7 Obama turns 53 years old 7 photos Obama turns 53 years old – President Barack Obama waves as he returns to the White House where he kicked off his 52nd birthday weekend. Hide Caption 6 of 7 Obama turns 53 years old 7 photos Obama turns 53 years old – President Barack Obama acknowledges early birthday wishes after making a statement at the White House on August 1. He turned 53 on the 4th. Hide Caption 7 of 7 (CNN) Here's a look at the life of Barack Obama, the 44th president of the United States. Personal: Birth date : August 4, 1961 Birth place : Honolulu, Hawaii Birth name : Barack Hussein Obama, Jr. Father : Barack Hussein Obama, Kenyan government official and former goat herder Mother : Stanley Ann (Dunham) Obama Soetoro, anthropologist Marriage : Michelle (Robinson) Obama (October 3, 1992 - present) Children : Natasha (Sasha), June 10, 2001, and Malia, July 4, 1998 Education : Columbia University, B.A., 1983, Harvard University, J.D., 1991 Religion : Christian The name Barack means \"one who is blessed\" in Swahili. Is the first African-American to be president of the Harvard Law Review. Timeline: 1964 - His parents divorce when Barack is two years old. Late 1960s - Lives in Indonesia with mother and stepfather Lolo Soetoro. 1971 - Returns to Hawaii to live with his maternal grandparents and attend school. November 24, 1982 - Barack Obama, Sr., dies in a car accident in Kenya. 1992-2004 - Practices civil rights law and teaches constitutional law at the University of Chicago Law School. November 7, 1995 - His mother, Stanley Ann (Dunham) Soetoro, 52, dies of ovarian cancer in Honolulu. 1995 - Publishes his autobiography \"Dreams from my Father,\" in which he admits to experimenting with marijuana and cocaine as a teenager. 1997-2005 - Illinois State Senator, representing the 13th District. 2000 - Runs for the U.S. House seat in Illinois' 1st District and loses to former Black Panther Bobby Rush. July 27, 2004 - Delivers the keynote address at the Democratic National Convention. November 2004 - Wins the U.S. Senate race in Illinois, defeating Alan Keyes. It is the first time in history a Senate race is between two African-American candidates. January 4, 2005 - Is sworn in as U.S. senator. 2006 - Wins a Grammy for Best Spoken Word Album for his reading of \"Dreams From My Father.\" August 20 - September 3, 2006 - Tours five African countries, including a visit to Nyangoma-Kogelo, Kenya, his late father's hometown. January 16, 2007 - Files papers with the FEC to form a presidential exploratory committee. February 10, 2007 - Announces his candidacy for president at an event in Springfield, Illinois. November 3, 2007 - Makes a surprise guest appearance on \"Saturday Night Live,\" as himself. January 3, 2008 - Wins the Iowa Democratic Caucuses with 38% of the vote. February 10, 2008 - Wins his second Grammy Award for Best Spoken Word Album for the audio version of his book, \"The Audacity of Hope: Thoughts on Reclaiming the American Dream.\" Former President Bill Clinton and former President Jimmy Carter were also nominated. March 18, 2008 - Makes a speech in Philadelphia defending his former pastor, Rev. Jeremiah Wright, who made racially-charged and anti-government comments during sermons. June 3, 2008 - Secures enough delegates to win the nomination - 2,118 - after the South Dakota and Montana primaries. June 19, 2008 - Announces he will not accept federal matching funds for his presidential campaign, foregoing $80 million dollars in federal money and a cap on how much he can spend. August 23, 2008 - Chooses Senator Joseph Biden (D-DE) as his running mate and has first rally with Biden in Springfield, Illinois in front of the old state capitol. August 27-28, 2008 - Is officially nominated as and accepts the nomination for president on the democratic ticket, becoming the first African-American candidate in U.S. history to lead a major party. November 3, 2008 - Grandmother, Madelyn Dunham, 86, dies in Hawaii after a long battle with cancer. November 4, 2008 - Is elected president of the United States with an estimated 66.7 million popular votes and 365 electoral votes. November 16, 2008 - Resigns his seat in the U.S. Senate. December 17, 2008 - Is named Time Magazine's \"Person of the Year.\" January 20, 2009 - Is sworn in as the 44th president of the United States January 22, 2009 - Issues executive orders regarding the closing of Guantanamo Bay, torture and creating a review of detention facilities and of individual cases. April 6, 2009 - During a speech made in Turkey, is quoted as saying, \"The United States is not, and will never be, at war with Islam.\" April 7, 2009 - Makes a surprise trip to Iraq , his first as president. October 9, 2009 - Is awarded the Nobel Peace Prize. March 23, 2010 - Signs the health care reform bill into law. March 28, 2010 - Makes a surprise visit to Afghanistan, the first as president. July 21, 2010 - Signs the Wall Street reform bill into law. August 31, 2010 - President Obama addresses the nation from the Oval Office to mark the end of U.S. combat operations in Iraq . September 1-2, 2010 - Hosts meetings between Israeli Prime Minister Benjamin Netanyahu and Palestinian President Mahmoud Abbas in Washington, DC. Other leaders attending meeting are Egyptian President Hosni Mubarak and King Abdullah II of Jordan. April 27, 2011 - The White House releases President Obama's original birth certificate . May 1, 2011 - In a televised press conference, Obama announces to the world that al Qaeda leader Osama bin Laden has been killed in a raid in Abbottabad, Pakistan . May 5, 2011 - Attends ceremony to honor victims of September 11th at Ground Zero. Lays a wreath, meets with first responders, families and colleagues of the victims. He also visits the \"Pride of Midtown\" firehouse, Engine 54, Ladder 9, Battalion 9, the unit that lost 15 men, the most of any one firehouse. May 25, 2011 - Is the first U.S. president to address the U.K. Parliament. October 21, 2011 - Announces the withdrawal of virtually all U.S. troops in Iraq by December 31, fulfilling a 2008 campaign pledge to end the war. May 9, 2012 - Excerpts from an interview with ABC air in which Obama endorses same-sex marriage. He is the first U.S. president to do so. He also says the legal decision should be up to the states. June 15, 2012 - Issues an executive order suspending the deportation of certain young undocumented immigrants who were brought to the United States as children. September 6, 2012 - Accepts the Democratic nomination for president at Time Warner Cable Arena in Charlotte, North Carolina. November 6, 2012 - Wins re-election as president of the United States beating Republican challenger and former governor of Massachusetts Mitt Romney . December 19, 2012 - Is named Time Magazine's \"Person of the Year\" for the second time. January 20, 2013 - Is sworn in for his second term, in a private ceremony in the Blue Room of the White House. December 17, 2014 - Obama announces plans to normalize diplomatic relations with Cuba and ease economic restrictions on the nation, a policy shift he called the end of an \"outdated approach\" to U.S.-Cuban relations that, \"for decades, has failed to advance our interests.\" Obama said the U.S. will move towards re-opening its embassy in the communist nation and allow some travel and trade that had been banned under a decades-long embargo instated during the Kennedy administration. May 12, 2015 - The Barack Obama Foundation announces that President Barack Obama's presidential library will be located in Chicago . More from US", "external_links": [], "published": "2015-05-12T22:07:00.000+03:00", "crawled": "2015-05-12T23:33:26.000+03:00", "highlightTitle": "", "social": {"gplus": {"shares": 0}, "pinterest": {"shares": 0}, "vk": {"shares": 0}, "linkedin": {"shares": 0}, "facebook": {"likes": 0, "shares": 0, "comments": 0}, "stumbledupon": {"shares": 0}}}