{"organizations": ["NBC"], "uuid": "6ccbc33567a3d541eb1227c5b1a905c09a432c5e", "thread": {"site_full": "edition.cnn.com", "main_image": "http://i2.cdn.turner.com/cnnnext/dam/assets/140123075857-02-bieber-0123-story-top.jpg", "site_section": "http://www.topix.com/rss/wire/tv", "section_title": "Television Newswire", "url": "http://edition.cnn.com/videos/tv/2015/05/13/high-profits-go-breck.cnn", "country": "US", "title": "Celebrities and marijuana", "performance_score": 0, "site": "cnn.com", "participants_count": 0, "title_full": "Celebrities and marijuana", "spam_score": 0.0, "site_type": "news", "published": "2015-05-24T15:13:00.000+03:00", "replies_count": 0, "uuid": "17c1700ddf5067b4baba4307d94b83b93a3a07af"}, "author": "", "url": "http://edition.cnn.com/2012/04/20/showbiz/gallery/celebrities-marijuana-april-20/index.html", "ord_in_thread": 0, "title": "Celebrities and marijuana", "locations": ["Britain", "U.S.", "Canada", "Denver", "Texas", "New Jersey", "Amsterdam", "Sierra Blanca", "Plano"], "entities": {"persons": [], "locations": [], "organizations": []}, "highlightText": "", "language": "english", "persons": ["Joseph Gordon-Levitt", "Woody Harrelson", "Marie Claire", "Natalie Portman", "Chace Crawford", "Justin Bieber", "Lady Gaga", "Cameron Diaz", "Miley Cyrus", "Seth Rogen", "Megan Fox", "George Lopez", "Brad Pitt"], "text": "Updated 1519 GMT (2219 HKT) May 21, 2015 Photos: Celebrities and marijuana 13 photos Celebrities and marijuana – NBC is reporting that the pilots of a private jet that flew Justin Bieber from Canada to New Jersey recently were allegedly forced to wear oxygen masks because of the overwhelming marijuana smoke on board. Several celebrities have been open about their love of the whacky weed... Hide Caption 1 of 13 Photos: Celebrities and marijuana 13 photos Celebrities and marijuana – Miley Cyrus says in the March 2014 issue of W magazine that \"I love weed. I just love getting stoned ... I just want it to be back to where it's, like, organic, good weed.\" Here she lights up during the MTV Europe Music Awards in Amsterdam in November 2013. Whether or not she was actually smoking marijuana onstage has not been confirmed. Hide Caption 2 of 13 Photos: Celebrities and marijuana 13 photos Celebrities and marijuana – Snoop is such a fan of pot, he created \"Rolling Words: A Smokable Songbook,\" a book of lyrics ... printed on rolling papers. You can even light a match on the book's spine. He is pictured at the inaugural High Times U.S. Cannabis Cup in Denver on April 19, 2013. Hide Caption 3 of 13 Photos: Celebrities and marijuana 13 photos Celebrities and marijuana – Woody Harrelson talked to 420 Magazine in 2008 about why he thought marijuana should be legalized: \"I do smoke, but I don't go through all this trouble just because I want to make my drug of choice legal. It's about personal freedom. We should have the right in this country to do what we want, if we don't hurt anybody.\" Hide Caption 4 of 13 Photos: Celebrities and marijuana 13 photos Celebrities and marijuana – When Cameron Diaz appeared on \"Lopez Tonight\" in 2011, George Lopez asked her if she knew Snoop growing up in \"the LBC.\" The \"What to Expect When You're Expecting\" actress responded : \"We went to high school together. ... He wore lots of ponytails and I'm pretty sure I bought weed from him.\" Hide Caption 5 of 13 Photos: Celebrities and marijuana 13 photos Celebrities and marijuana – Funnyman Seth Rogen told High Times that he drew from his own experience when playing a stoner in 2008's \"Pineapple Express.\" \"Everyone's been with someone who's bought weed or knows someone who's sold weed or gone and bought weed themselves,\" he said. Hide Caption 6 of 13 Photos: Celebrities and marijuana 13 photos Celebrities and marijuana – During an interview with \"60 Minutes,\" Lady Gaga said: \"I smoke a lot of pot when I write music. ... I drink a lot of whiskey and I smoke weed when I write. I don't do it a lot because it's not good for my voice.\" Hide Caption 7 of 13 Photos: Celebrities and marijuana 13 photos Celebrities and marijuana – Police allegedly found three pot cookies and one brownie on Armie Hammer in Sierra Blanca, Texas, back in January, according to TMZ. Hide Caption 8 of 13 Photos: Celebrities and marijuana 13 photos Celebrities and marijuana – \"OK, so I didn't really go to high school parties,\" Natalie Portman told Marie Claire in 2009, \"and yeah, I didn't touch pot till I was in my 20s. I didn't get flat-out drunk until I went to college. But I think that's a good thing in many ways.\" Hide Caption 9 of 13 Photos: Celebrities and marijuana 13 photos Celebrities and marijuana – In 2009, Brad Pitt told Parade about his early days in the biz: \"I liked to smoke a bit of grass at the time, and I became very sheltered. Then I got bored. I was turning into a damn doughnut, really.\" Hide Caption 10 of 13 Photos: Celebrities and marijuana 13 photos Celebrities and marijuana – In a 2009 interview with Britain's GQ , Megan Fox said, \"I can't tell you how much bulls*** I've been through because I will openly say that I smoke weed.\" Hide Caption 11 of 13 Photos: Celebrities and marijuana 13 photos Celebrities and marijuana – \"When I was in high school, I loved smoking weed,\" Joseph Gordon-Levitt told Details in 2010. \"I loved it. But I cut myself to once a month. That was my rule. ... That's my drug of choice.\" Hide Caption 12 of 13 Photos: Celebrities and marijuana 13 photos Celebrities and marijuana – \"Gossip Girl\" actor Chace Crawford was arrested on a marijuana charge in his hometown Plano, Texas, in 2010. Hide Caption Several celebrities have been open about their love of the whacky weed. View the list. More from showbiz", "external_links": [], "published": "2015-05-24T15:13:00.000+03:00", "crawled": "2015-05-24T15:42:03.000+03:00", "highlightTitle": "", "social": {"gplus": {"shares": 0}, "pinterest": {"shares": 0}, "vk": {"shares": 0}, "linkedin": {"shares": 0}, "facebook": {"likes": 0, "shares": 0, "comments": 0}, "stumbledupon": {"shares": 0}}}