{"organizations": ["Brother's Keeper Alliance", "Lehman College"], "uuid": "30c94f4f54a3c286a14ec3f787c152501fcb6e67", "thread": {"site_full": "www.huffingtonpost.com", "main_image": "http://i.huffpost.com/gen/2911056/images/o-BARACK-OBAMA-facebook.jpg", "site_section": "", "section_title": "", "url": "http://www.huffingtonpost.com/2015/05/04/obama-my-brothers-keeper_n_7207328.html", "country": "", "title": "Obama Says He'll Continue To Work On Racial Equality After He Leaves Office", "performance_score": 0, "site": "huffingtonpost.com", "participants_count": 0, "title_full": "Obama Says He'll Continue To Work On Racial Equality After He Leaves Office", "spam_score": 0.0, "site_type": "news", "published": "2015-05-05T00:41:00.000+03:00", "replies_count": 0, "uuid": "30c94f4f54a3c286a14ec3f787c152501fcb6e67"}, "author": "", "url": "http://www.huffingtonpost.com/2015/05/04/obama-my-brothers-keeper_n_7207328.html", "ord_in_thread": 0, "title": "Obama Says He'll Continue To Work On Racial Equality After He Leaves Office", "locations": ["Baltimore", "New York City", "Bronx", "U.S.", "NY", "NEW YORK"], "entities": {"persons": [], "locations": [], "organizations": []}, "highlightText": "", "language": "english", "persons": ["Spencer Platt", "Barack Obama", "David Letterman", "Obama"], "text": "Obama Says He'll Continue To Work On Racial Equality After He Leaves Office Reuters Updated: 5 minutes ago NEW YORK, NY - MAY 04: U.S. President Barack Obama speaks during the launch of a nonprofit group, My Brother's Keeper Alliance at Lehman College in the Bronx borough on May 4, 2015 in New York City. The President arrived in New York City for several appearances including a taping of the Late Show with David Letterman. In the afternoon speech at the college the President addressed the racially charged turmoil in Baltimore and other American cities. (Photo by Spencer Platt/Getty Images) | Spencer Platt via Getty Images reddit \nBy Julia Edwards \nMay 4 (Reuters) - Following a week of racially charged protests in Baltimore, U.S. President Barack Obama on Monday said obstacles facing minority men from birth put them in a position of having \"the odds stacked against them.\" \nObama said black and Latino men feel that disadvantage, and he credited their sense of frustration about their lives and opportunities for the intensity of recent protests around the country. \nHe spoke at Lehman College in the Bronx to announce the launch of My Brother's Keeper Alliance, a nonprofit organization that is a spinoff of a White House initiative to increase opportunities for young minority men. \n\"That sense of unfairness, powerlessness, people not hearing their voices, that's helped fuel some of the protests that we've seen in places like Baltimore, Ferguson and right here in New York,\" Obama said, referring to demonstrations that followed the deaths of unarmed black men after interactions with police. \nObama said he would continue to work on the issue after his presidency, a possible foreshadowing of his future involvement with My Brother's Keeper Alliance. \n\"We see ourselves in these young men,\" Obama said of himself and the leaders of My Brother's Keeper Alliance. \nThe nonprofit, to be headed by Joe Echevarria, former chief executive of consultancy Deloitte, will develop guidance for companies to increase access to jobs for racial minorities. \nCompanies including American Express Co, Pepsi Co and News Corp have committed a combined total of $80 million in money and in-kind donations to My Brother's Keeper Alliance. \nRules around fundraising for My Brother's Keeper Alliance while Obama is still in office are likely to be scrutinized. Questions have been raised about the influence donors to the Clinton Foundation wielded while Hillary Clinton was Secretary of State. \nWhite House spokesman Josh Earnest said My Brother's Keeper Alliance will be responsible for determining its own fundraising policies. (Additional reporting by Emily Stephenson; Editing by Sandra Maler and Eric Walsh) Also on HuffPost: Acts Of Kindness In Baltimore of   The musicians of the Baltimore Symphony Orchestra played outside the Joseph Meyerhoff Symphony Hall on April 29. \"It seems we could all use a little music in our lives right about now,\" a description accompanying a video of the performance on the orchestra's YouTube page said. Residents, reflected off broken glass, clean up after an evening of riots following the funeral of Freddie Gray on Tuesday, April 28, 2015, in Baltimore. The violence that started in West Baltimore on Monday afternoon had spread to East Baltimore and neighborhoods close to downtown and near Camden Yards. (AP Photo/Evan Vucci) Maryland state troopers stand guard as residents clean up, Tuesday, April 28, 2015, after an evening of riots following the funeral of Freddie Gray on Monday, in Baltimore. (AP Photo/Evan Vucci) Maryland state troopers stand guard as residents clean up, Tuesday, April 28, 2015, after an evening of riots following the funeral of Freddie Gray on Monday, in Baltimore. (AP Photo/Evan Vucci) Volunteers clean up a business damaged during an evening of riots following the funeral of Freddie Gray on Tuesday, April 28, 2015, in Baltimore. The violence that started in West Baltimore on Monday afternoon had spread to East Baltimore and neighborhoods close to downtown and near Camden Yards. (AP Photo/Evan Vucci) Maryland state troopers stand guard as residents clean up, Tuesday, April 28, 2015, after an evening of riots following the funeral of Freddie Gray on Monday, in Baltimore. (AP Photo/Evan Vucci) Volunteers clean up a business damaged during an evening of riots following the funeral of Freddie Gray on Tuesday, April 28, 2015, in Baltimore. The violence that started in West Baltimore on Monday afternoon had spread to East Baltimore and neighborhoods close to downtown and near Camden Yards. (AP Photo/Evan Vucci) Men clean up during a protest, Monday, April 27, 2015, following the funeral of Freddie Gray in Baltimore. (AP Photo/Matt Rourke) Residents clean up after an evening of riots on Tuesday, April 28, 2015, in Baltimore. National Guard troops fanned out through the city, shield-bearing police officers blocked the streets and firefighters doused still-simmering blazes early Tuesday as a growing area of Baltimore shuddered from riots following the funeral of Freddie Gray who died in police custody. (AP Photo/Evan Vucci) Maryland state troopers stand guard, Tuesday, April 28, 2015, as residents clean up after an evening of riots following the funeral of Freddie Gray on Monday, in Baltimore. (AP Photo/Evan Vucci)  Share ", "external_links": [], "published": "2015-05-05T00:41:00.000+03:00", "crawled": "2015-05-05T00:42:06.000+03:00", "highlightTitle": "", "social": {"gplus": {"shares": 0}, "pinterest": {"shares": 0}, "vk": {"shares": 0}, "linkedin": {"shares": 0}, "facebook": {"likes": 0, "shares": 0, "comments": 0}, "stumbledupon": {"shares": 0}}}